{
  "schema_id": "gait.gate.delegation_audit_record",
  "schema_version": "1.0.0",
  "created_at": "2026-02-05T00:00:00Z",
  "producer_version": "0.0.0-dev",
  "trace_id": "trace_demo",
  "tool_name": "tool.write",
  "intent_digest": "1111111111111111111111111111111111111111111111111111111111111111",
  "policy_digest": "2222222222222222222222222222222222222222222222222222222222222222",
  "delegation_required": true,
  "valid_delegations": 1,
  "delegated": true,
  "delegation_ref": "delegation_demo",
  "entries": [
    {
      "token_id": "delegation_demo",
      "delegator_identity": "agent.lead",
      "delegate_identity": "agent.specialist",
      "scope": ["tool:tool.write"],
      "expires_at": "2026-02-05T01:00:00Z",
      "valid": true
    }
  ]
}
